name,url,description
"JASMIN A MASLINA","https://rs.gaultmillau.com/en/restaurants/jasmin-a-maslina","The magic unfolds in the old apartment converted into a boutique restaurant, where the menu evolves with the seasons. Begin with silky marinated veal tongue draped in a sweet horseradish emulsion and accented with the crunch of walnuts, the sweetness of dried figs, and a bright vinaigrette of young spinach. Like the tongue, one of the best renditions of duck breast followed. The timing of the sear was precise to the second; the cross-section revealed a flawless gradient from rose to deep burgundy. The meat melts on the tongue, while the duck belly offers a sublime caramelization. A vibrant sauce of sour cherry, carrot, and pumpkin provides a sophisticated counterpoint of sweetness, balanced by the earthy velvet of celery purée in the play of textures and shades of transition from dull to refreshing notes. The finale is a dessert fit for royalty: a silky chocolate mousse of profound depth, set atop a slice of homemade kuglof. As the cake gradually absorbs the rich chocolate sauce and mousse, it creates a symphony of textures that is both nostalgic and surprising."
"KORPA  DELI MARKET I BISTRO","https://rs.gaultmillau.com/en/restaurants/korpa-bistro","Overlooking a wide, vibrant boulevard in Novi Sad, this gem welcomes guests with an electric atmosphere, friendly staff and a menu that defies easy categorization We began our exploration with a duo of inventive appetizers: oyster mushrooms with leeks and feta cheese and rolled carpaccio. Delicate oyster mushrooms with earthy notes, slightly sweet, with roasted leeks that added flavor and feta, which perfectly countered the sweetness of the leeks and the full nuances of the mushrooms. The carpaccio was extremely fresh, chilled, rolled so that it was streaked with the delicious fat of the meat. Cut into nice round slices, it was topped with a sauce made from roasted bone marrow, dried apricots, Parmesan and enhanced with apple slices that added sweetness and citrus notes. The pièce de résistance, however, was the parmesan-crusted leg of lamb. The meat is rolled in panko and Parmesan and fried until golden and crispy. It was placed on a pillow of mashed potatoes, topped with two shavings of Parmesan cheese, and finished with a surprisingly harmonious sweet oyster sauce. The dish is a brilliant interplay of crunch, salt, and sea - a combination we cannot recommend highly enough."
"R3B - ROZBRAT I STREET-BISTRO","https://rs.gaultmillau.com/en/restaurants/r3b---rozbrat-i-street-bistro","Rozbrat combines contemporary cuisine with Central European Comfort sensibility in a bistro-restaurant format. The modern ambience follows the tone of a casual approach to gastronomy and works naturally as a place for breakfast, lunch or a meeting with a beer. Premium beef smash burgers take center stage on the menu, in classic or Signature variants with BBQ relish or Truffle-Mayo sauce. Each burger has a vegetarian version, with a patty made of oat, chickpeas and seeds, with caramelized onions and notes of smoke. All-day breakfast comes on a brioche - sirloin steak or pancetta, eggs and cheddar, your choice. Rozbrat is a place that combines a serious bite with stable quality and clearly defined tastes."
"LE KLOK BISTRO","https://rs.gaultmillau.com/en/restaurants/le-klok-bistro","Perched within the storied walls of the Petrovaradin Fortress, this intimate restaurant offers a masterful dialogue between French classicism and the creative soul of Novi Sad. The journey begins with a steak tartare of exceptional grace - finely hand-chopped, silky, and served with house-made paprika crisps. Resistance is futile when the warm, homemade, buttery, toasted, extraordinarily good brioche arrives; it is the essential canvas for this masterpiece. The narrative deepens with the slow-cooked lamb, a dish of profound richness complemented by a delicate aioli. However, the true ‚star of the house‘ is the duck breast. Roasted to a perfect medium and finished with an aromatic aniseed glaze, it offers a brilliant play of freshness and spice. On the plate, a velvet sweet corn purée and butter-foamed broccoli provide a sophisticated balance, while a hidden gem awaits: a duck leg croquette, featuring a shatteringly crisp crust and a succulent, shredded center This dish is a well-deserved star of the well-thought-out and well-chosen menu, which offers the very specialties and classics of French cuisine with the signature stamp of the chef from Novi Sad."
"KONOBA RIBA RIBI GRIZE REP","https://rs.gaultmillau.com/en/restaurants/konoba-riba-ribi-grize-rep","In the heart of the Vojvodina plains, a rare sanctuary of ‘gastro-archaeology’ reveals a hidden piece of the ancient Pannonian Sea. The journey begins with white cod, a delicacy prepared over the course of two years. Served on crisp toasted bread with a drizzle of olive oil, a sun-ripened cherry tomato, and a single olive, it offers a profound depth of flavor that lingers long after the first bite. The transition to the tagliatelle with shrimp is seamless; the shellfish are sweet and vibrant, tossed in a buzara sauce that strikes a perfect, bright acidity. The sauce captures the wine’s delicate balance of sweetness and zest, elevating the simplicity of the baked fish to a new dimension. Pure Mediterranean taste, balanced and unobtrusive. In addition to potatoes, vegetables, kale, risotto, asparagus and potato salad, we decided on a classic, Dalmatian-style stew, a rare tribute to the humble Swiss chard - treated here with immense respect, the greens are remarkably fresh, tender, and imbued with a mild, nutty character. It is a meal that moves the spirit, transporting the guest from the fertile plains to a sun-drenched Mediterranean shore."
"BISTRO POSLASTIČARNICA VREMEPLOV","https://rs.gaultmillau.com/en/restaurants/vremeplov","Bistro Vremeplov builds its identity around the idea that flavors can guide us through time, combining classic recipes with contemporary sensibilities. Desserts play a central role, relying on the Central European and local traditions, with clearly recognizable classics such as Reforma and Esterházy